"","Title","Year","Rated","Released","Runtime","Genre","Director","Writer","Actors","Plot","Language","Country","Awards","Poster","Ratings.Source","Ratings.Value","Metascore","imdbRating","imdbVotes","imdbID","Type","DVD","BoxOffice","Production","Website","Response"
"1","The Shawshank Redemption","1994","R","14 Oct 1994","142 min","Drama","Frank Darabont","Stephen King (short story ""Rita Hayworth and Shawshank Redemption""), Frank Darabont (screenplay)","Tim Robbins, Morgan Freeman, Bob Gunton, William Sadler","Two imprisoned men bond over a number of years, finding solace and eventual redemption through acts of common decency.","English","USA","Nominated for 7 Oscars. Another 21 wins & 35 nominations.","https://m.media-amazon.com/images/M/MV5BMDFkYTc0MGEtZmNhMC00ZDIzLWFmNTEtODM1ZmRlYWMwMWFmXkEyXkFqcGdeQXVyMTMxODk2OTU@._V1_SX300.jpg","Internet Movie Database",9.3,"80","9.3","2,217,195","tt0111161","movie","27 Jan 1998","N/A","Columbia Pictures","N/A","True"
"2","The Godfather","1972","R","24 Mar 1972","175 min","Crime, Drama","Francis Ford Coppola","Mario Puzo (screenplay by), Francis Ford Coppola (screenplay by), Mario Puzo (based on the novel by)","Marlon Brando, Al Pacino, James Caan, Richard S. Castellano","The aging patriarch of an organized crime dynasty transfers control of his clandestine empire to his reluctant son.","English, Italian, Latin","USA","Won 3 Oscars. Another 26 wins & 30 nominations.","https://m.media-amazon.com/images/M/MV5BM2MyNjYxNmUtYTAwNi00MTYxLWJmNWYtYzZlODY3ZTk3OTFlXkEyXkFqcGdeQXVyNzkwMjQ5NzM@._V1_SX300.jpg","Internet Movie Database",9.2,"100","9.2","1,532,092","tt0068646","movie","09 Oct 2001","N/A","Paramount Pictures","N/A","True"
"3","The Godfather: Part II","1974","R","18 Dec 1974","202 min","Crime, Drama","Francis Ford Coppola","Francis Ford Coppola (screenplay by), Mario Puzo (screenplay by), Mario Puzo (based on the novel by)","Al Pacino, Robert Duvall, Diane Keaton, Robert De Niro","The early life and career of Vito Corleone in 1920s New York City is portrayed, while his son, Michael, expands and tightens his grip on the family crime syndicate.","English, Italian, Spanish, Latin, Sicilian","USA","Won 6 Oscars. Another 11 wins & 20 nominations.","https://m.media-amazon.com/images/M/MV5BMWMwMGQzZTItY2JlNC00OWZiLWIyMDctNDk2ZDQ2YjRjMWQ0XkEyXkFqcGdeQXVyNzkwMjQ5NzM@._V1_SX300.jpg","Internet Movie Database",9,"90","9.0","1,072,495","tt0071562","movie","24 May 2005","N/A","Paramount Pictures","N/A","True"
"4","The Dark Knight","2008","PG-13","18 Jul 2008","152 min","Action, Crime, Drama, Thriller","Christopher Nolan","Jonathan Nolan (screenplay), Christopher Nolan (screenplay), Christopher Nolan (story), David S. Goyer (story), Bob Kane (characters)","Christian Bale, Heath Ledger, Aaron Eckhart, Michael Caine","When the menace known as the Joker wreaks havoc and chaos on the people of Gotham, Batman must accept one of the greatest psychological and physical tests of his ability to fight injustice.","English, Mandarin","USA, UK","Won 2 Oscars. Another 153 wins & 159 nominations.","https://m.media-amazon.com/images/M/MV5BMTMxNTMwODM0NF5BMl5BanBnXkFtZTcwODAyMTk2Mw@@._V1_SX300.jpg","Internet Movie Database",9,"84","9.0","2,200,152","tt0468569","movie","09 Dec 2008","$533,316,061","Warner Bros. Pictures/Legendary","N/A","True"
"5","12 Angry Men","1957","Approved","10 Apr 1957","96 min","Drama","Sidney Lumet","Reginald Rose (story), Reginald Rose (screenplay)","Martin Balsam, John Fiedler, Lee J. Cobb, E.G. Marshall","A jury holdout attempts to prevent a miscarriage of justice by forcing his colleagues to reconsider the evidence.","English","USA","Nominated for 3 Oscars. Another 16 wins & 9 nominations.","https://m.media-amazon.com/images/M/MV5BMWU4N2FjNzYtNTVkNC00NzQ0LTg0MjAtYTJlMjFhNGUxZDFmXkEyXkFqcGdeQXVyNjc1NTYyMjg@._V1_SX300.jpg","Internet Movie Database",8.9,"96","8.9","650,851","tt0050083","movie","06 Mar 2001","N/A","Criterion Collection","N/A","True"
"6","Schindler's List","1993","R","04 Feb 1994","195 min","Biography, Drama, History","Steven Spielberg","Thomas Keneally (book), Steven Zaillian (screenplay)","Liam Neeson, Ben Kingsley, Ralph Fiennes, Caroline Goodall","In German-occupied Poland during World War II, industrialist Oskar Schindler gradually becomes concerned for his Jewish workforce after witnessing their persecution by the Nazis.","English, Hebrew, German, Polish","USA","Won 7 Oscars. Another 83 wins & 49 nominations.","https://m.media-amazon.com/images/M/MV5BNDE4OTMxMTctNmRhYy00NWE2LTg3YzItYTk3M2UwOTU5Njg4XkEyXkFqcGdeQXVyNjU0OTQ0OTY@._V1_SX300.jpg","Internet Movie Database",8.9,"94","8.9","1,156,933","tt0108052","movie","09 Mar 2004","N/A","Universal Pictures","N/A","True"
"7","The Lord of the Rings: The Return of the King","2003","PG-13","17 Dec 2003","201 min","Adventure, Drama, Fantasy","Peter Jackson","J.R.R. Tolkien (novel), Fran Walsh (screenplay), Philippa Boyens (screenplay), Peter Jackson (screenplay)","Noel Appleby, Ali Astin, Sean Astin, David Aston","Gandalf and Aragorn lead the World of Men against Sauron's army to draw his gaze from Frodo and Sam as they approach Mount Doom with the One Ring.","English, Quenya, Old English, Sindarin","New Zealand, USA","Won 11 Oscars. Another 199 wins & 122 nominations.","https://m.media-amazon.com/images/M/MV5BNzA5ZDNlZWMtM2NhNS00NDJjLTk4NDItYTRmY2EwMWZlMTY3XkEyXkFqcGdeQXVyNzkwMjQ5NzM@._V1_SX300.jpg","Internet Movie Database",8.9,"94","8.9","1,576,026","tt0167260","movie","25 May 2004","$364,000,000","New Line Cinema","N/A","True"
"8","Pulp Fiction","1994","R","14 Oct 1994","154 min","Crime, Drama","Quentin Tarantino","Quentin Tarantino (stories), Roger Avary (stories), Quentin Tarantino","Tim Roth, Amanda Plummer, Laura Lovelace, John Travolta","The lives of two mob hitmen, a boxer, a gangster and his wife, and a pair of diner bandits intertwine in four tales of violence and redemption.","English, Spanish, French","USA","Won 1 Oscar. Another 68 wins & 74 nominations.","https://m.media-amazon.com/images/M/MV5BNGNhMDIzZTUtNTBlZi00MTRlLWFjM2ItYzViMjE3YzI5MjljXkEyXkFqcGdeQXVyNzkwMjQ5NzM@._V1_SX300.jpg","Internet Movie Database",8.9,"94","8.9","1,744,145","tt0110912","movie","19 May 1998","N/A","Miramax Films","N/A","True"
"9","The Good, the Bad and the Ugly","1966","R","29 Dec 1967","178 min","Western","Sergio Leone","Luciano Vincenzoni (story), Sergio Leone (story), Agenore Incrocci (screenplay), Furio Scarpelli (screenplay), Luciano Vincenzoni (screenplay), Sergio Leone (screenplay)","Eli Wallach, Clint Eastwood, Lee Van Cleef, Aldo Giuffrè","A bounty hunting scam joins two men in an uneasy alliance against a third in a race to find a fortune in gold buried in a remote cemetery.","Italian","Italy, Spain, West Germany","2 wins & 4 nominations.","https://m.media-amazon.com/images/M/MV5BOTQ5NDI3MTI4MF5BMl5BanBnXkFtZTgwNDQ4ODE5MDE@._V1_SX300.jpg","Internet Movie Database",8.8,"90","8.8","658,445","tt0060196","movie","18 Nov 1997","N/A","United Artists","N/A","True"
"10","The Lord of the Rings: The Fellowship of the Ring","2001","PG-13","19 Dec 2001","178 min","Action, Adventure, Drama, Fantasy","Peter Jackson","J.R.R. Tolkien (novel), Fran Walsh (screenplay), Philippa Boyens (screenplay), Peter Jackson (screenplay)","Alan Howard, Noel Appleby, Sean Astin, Sala Baker","A meek Hobbit from the Shire and eight companions set out on a journey to destroy the powerful One Ring and save Middle-earth from the Dark Lord Sauron.","English, Sindarin","New Zealand, USA","Won 4 Oscars. Another 115 wins & 124 nominations.","https://m.media-amazon.com/images/M/MV5BN2EyZjM3NzUtNWUzMi00MTgxLWI0NTctMzY4M2VlOTdjZWRiXkEyXkFqcGdeQXVyNDUzOTQ5MjY@._V1_SX300.jpg","Internet Movie Database",8.8,"92","8.8","1,586,250","tt0120737","movie","06 Aug 2002","$314,000,000","New Line Cinema","N/A","True"
"11","Fight Club","1999","R","15 Oct 1999","139 min","Drama","David Fincher","Chuck Palahniuk (novel), Jim Uhls (screenplay)","Edward Norton, Brad Pitt, Meat Loaf, Zach Grenier","An insomniac office worker and a devil-may-care soapmaker form an underground fight club that evolves into something much, much more.","English","USA, Germany","Nominated for 1 Oscar. Another 10 wins & 37 nominations.","https://m.media-amazon.com/images/M/MV5BMmEzNTkxYjQtZTc0MC00YTVjLTg5ZTEtZWMwOWVlYzY0NWIwXkEyXkFqcGdeQXVyNzkwMjQ5NzM@._V1_SX300.jpg","Internet Movie Database",8.8,"66","8.8","1,768,254","tt0137523","movie","06 Jun 2000","N/A","20th Century Fox","N/A","True"
"12","Forrest Gump","1994","PG-13","06 Jul 1994","142 min","Drama, Romance","Robert Zemeckis","Winston Groom (novel), Eric Roth (screenplay)","Tom Hanks, Rebecca Williams, Sally Field, Michael Conner Humphreys","The presidencies of Kennedy and Johnson, the events of Vietnam, Watergate, and other historical events unfold through the perspective of an Alabama man with an IQ of 75, whose only desire is to be reunited with his childhood sweetheart.","English","USA","Won 6 Oscars. Another 44 wins & 74 nominations.","https://m.media-amazon.com/images/M/MV5BNWIwODRlZTUtY2U3ZS00Yzg1LWJhNzYtMmZiYmEyNmU1NjMzXkEyXkFqcGdeQXVyMTQxNzMzNDI@._V1_SX300.jpg","Internet Movie Database",8.8,"82","8.8","1,703,247","tt0109830","movie","28 Aug 2001","$330,000,000","Paramount Pictures","N/A","True"
"13","Inception","2010","PG-13","16 Jul 2010","148 min","Action, Adventure, Sci-Fi, Thriller","Christopher Nolan","Christopher Nolan","Leonardo DiCaprio, Joseph Gordon-Levitt, Ellen Page, Tom Hardy","A thief who steals corporate secrets through the use of dream-sharing technology is given the inverse task of planting an idea into the mind of a C.E.O.","English, Japanese, French","USA, UK","Won 4 Oscars. Another 152 wins & 217 nominations.","https://m.media-amazon.com/images/M/MV5BMjAxMzY3NjcxNF5BMl5BanBnXkFtZTcwNTI5OTM0Mw@@._V1_SX300.jpg","Internet Movie Database",8.8,"74","8.8","1,953,512","tt1375666","movie","07 Dec 2010","$292,568,851","Warner Bros. Pictures","N/A","True"
"14","Star Wars: Episode V - The Empire Strikes Back","1980","PG","20 Jun 1980","124 min","Action, Adventure, Fantasy, Sci-Fi","Irvin Kershner","Leigh Brackett (screenplay by), Lawrence Kasdan (screenplay by), George Lucas (story by)","Mark Hamill, Harrison Ford, Carrie Fisher, Billy Dee Williams","After the Rebels are brutally overpowered by the Empire on the ice planet Hoth, Luke Skywalker begins Jedi training with Yoda, while his friends are pursued by Darth Vader and a bounty hunter named Boba Fett all over the galaxy.","English","USA","Won 1 Oscar. Another 24 wins & 20 nominations.","https://m.media-amazon.com/images/M/MV5BYmU1NDRjNDgtMzhiMi00NjZmLTg5NGItZDNiZjU5NTU4OTE0XkEyXkFqcGdeQXVyNzkwMjQ5NzM@._V1_SX300.jpg","Internet Movie Database",8.7,"82","8.7","1,109,656","tt0080684","movie","21 Sep 2004","$4,548,170","Twentieth Century Fox","N/A","True"
"15","The Lord of the Rings: The Two Towers","2002","PG-13","18 Dec 2002","179 min","Adventure, Drama, Fantasy","Peter Jackson","J.R.R. Tolkien (novel), Fran Walsh (screenplay), Philippa Boyens (screenplay), Stephen Sinclair (screenplay), Peter Jackson (screenplay)","Bruce Allpress, Sean Astin, John Bach, Sala Baker","While Frodo and Sam edge closer to Mordor with the help of the shifty Gollum, the divided fellowship makes a stand against Sauron's new ally, Saruman, and his hordes of Isengard.","English, Sindarin, Old English","New Zealand, USA","Won 2 Oscars. Another 123 wins & 137 nominations.","https://m.media-amazon.com/images/M/MV5BNGE5MzIyNTAtNWFlMC00NDA2LWJiMjItMjc4Yjg1OWM5NzhhXkEyXkFqcGdeQXVyNzkwMjQ5NzM@._V1_SX300.jpg","Internet Movie Database",8.7,"87","8.7","1,423,436","tt0167261","movie","26 Aug 2003","$339,700,000","New Line Cinema","N/A","True"
"16","The Matrix","1999","R","31 Mar 1999","136 min","Action, Sci-Fi","Lana Wachowski, Lilly Wachowski","Lilly Wachowski, Lana Wachowski","Keanu Reeves, Laurence Fishburne, Carrie-Anne Moss, Hugo Weaving","A computer hacker learns from mysterious rebels about the true nature of his reality and his role in the war against its controllers.","English","USA","Won 4 Oscars. Another 37 wins & 50 nominations.","https://m.media-amazon.com/images/M/MV5BNzQzOTk3OTAtNDQ0Zi00ZTVkLWI0MTEtMDllZjNkYzNjNTc4L2ltYWdlXkEyXkFqcGdeQXVyNjU0OTQ0OTY@._V1_SX300.jpg","Internet Movie Database",8.7,"73","8.7","1,597,196","tt0133093","movie","21 Sep 1999","N/A","Warner Bros. Pictures","N/A","True"
"17","Goodfellas","1990","R","21 Sep 1990","146 min","Biography, Crime, Drama","Martin Scorsese","Nicholas Pileggi (book), Nicholas Pileggi (screenplay), Martin Scorsese (screenplay)","Robert De Niro, Ray Liotta, Joe Pesci, Lorraine Bracco","The story of Henry Hill and his life in the mob, covering his relationship with his wife Karen Hill and his mob partners Jimmy Conway and Tommy DeVito in the Italian-American crime syndicate.","English, Italian","USA","Won 1 Oscar. Another 43 wins & 38 nominations.","https://m.media-amazon.com/images/M/MV5BY2NkZjEzMDgtN2RjYy00YzM1LWI4ZmQtMjIwYjFjNmI3ZGEwXkEyXkFqcGdeQXVyNzkwMjQ5NzM@._V1_SX300.jpg","Internet Movie Database",8.7,"90","8.7","960,866","tt0099685","movie","26 Mar 1997","N/A","Warner Bros.","N/A","True"
"18","One Flew Over the Cuckoo's Nest","1975","R","19 Nov 1975","133 min","Drama","Milos Forman","Lawrence Hauben (screenplay), Bo Goldman (screenplay), Ken Kesey (based on the novel by), Dale Wasserman (the play version: ""One Flew Over the Cuckoo's Nest"" by)","Jack Nicholson, Louise Fletcher, Will Sampson, Michael Berryman","A criminal pleads insanity and is admitted to a mental institution, where he rebels against the oppressive nurse and rallies up the scared patients.","English","USA","Won 5 Oscars. Another 30 wins & 13 nominations.","https://m.media-amazon.com/images/M/MV5BZjA0OWVhOTAtYWQxNi00YzNhLWI4ZjYtNjFjZTEyYjJlNDVlL2ltYWdlL2ltYWdlXkEyXkFqcGdeQXVyMTQxNzMzNDI@._V1_SX300.jpg","Internet Movie Database",8.7,"83","8.7","875,648","tt0073486","movie","09 Dec 1997","N/A","United Artists","N/A","True"
"19","Seven Samurai","1954","Not Rated","19 Nov 1956","207 min","Action, Adventure, Drama","Akira Kurosawa","Akira Kurosawa (screenplay), Shinobu Hashimoto (screenplay), Hideo Oguni (screenplay)","Toshirô Mifune, Takashi Shimura, Keiko Tsushima, Yukiko Shimazaki","A poor village under attack by bandits recruits seven unemployed samurai to help them defend themselves.","Japanese","Japan","Nominated for 2 Oscars. Another 5 wins & 6 nominations.","https://m.media-amazon.com/images/M/MV5BODdlYjU1Y2MtMWUxMy00YjJjLTgyMWItNzgzZmZkNTYxNWFkXkEyXkFqcGdeQXVyMTAwMjU1MzA2._V1_SX300.jpg","Internet Movie Database",8.6,"98","8.6","298,721","tt0047478","movie","01 Mar 1999","N/A","Columbia Pictures","N/A","True"
"20","Se7en","1995","R","22 Sep 1995","127 min","Crime, Drama, Mystery, Thriller","David Fincher","Andrew Kevin Walker","Morgan Freeman, Andrew Kevin Walker, Daniel Zacapa, Brad Pitt","Two detectives, a rookie and a veteran, hunt a serial killer who uses the seven deadly sins as his motives.","English","USA","Nominated for 1 Oscar. Another 29 wins & 40 nominations.","https://m.media-amazon.com/images/M/MV5BOTUwODM5MTctZjczMi00OTk4LTg3NWUtNmVhMTAzNTNjYjcyXkEyXkFqcGdeQXVyNjU0OTQ0OTY@._V1_SX300.jpg","Internet Movie Database",8.6,"65","8.6","1,365,575","tt0114369","movie","14 Apr 1997","N/A","New Line Cinema","N/A","True"
"21","City of God","2002","R","13 Feb 2004","130 min","Crime, Drama","Fernando Meirelles, Kátia Lund(co-director)","Paulo Lins (novel), Bráulio Mantovani (screenplay)","Alexandre Rodrigues, Leandro Firmino, Phellipe Haagensen, Douglas Silva","In the slums of Rio, two kids' paths diverge as one struggles to become a photographer and the other a kingpin.","Portuguese","Brazil, France, Germany","Nominated for 4 Oscars. Another 75 wins & 44 nominations.","https://m.media-amazon.com/images/M/MV5BNDJiNTEwMjMtOGQ1ZC00OTczLWFjZjctZWQ0MGJjZmFkMjcwXkEyXkFqcGdeQXVyNjU0OTQ0OTY@._V1_SX300.jpg","Internet Movie Database",8.6,"79","8.6","674,394","tt0317248","movie","08 Jun 2004","N/A","Miramax Films","N/A","True"
"22","Life Is Beautiful","1997","PG-13","12 Feb 1999","116 min","Comedy, Drama, Romance, War","Roberto Benigni","Vincenzo Cerami (story and screenplay by), Roberto Benigni (story and screenplay by)","Roberto Benigni, Nicoletta Braschi, Giorgio Cantarini, Giustino Durano","When an open-minded Jewish librarian and his son become victims of the Holocaust, he uses a perfect mixture of will, humor, and imagination to protect his son from the dangers around their camp.","Italian, German, English","Italy","Won 3 Oscars. Another 67 wins & 51 nominations.","https://m.media-amazon.com/images/M/MV5BYmJmM2Q4NmMtYThmNC00ZjRlLWEyZmItZTIwOTBlZDQ3NTQ1XkEyXkFqcGdeQXVyMTQxNzMzNDI@._V1_SX300.jpg","Internet Movie Database",8.6,"59","8.6","591,760","tt0118799","movie","09 Nov 1999","N/A","Miramax","N/A","True"
"23","The Silence of the Lambs","1991","R","14 Feb 1991","118 min","Crime, Drama, Thriller","Jonathan Demme","Thomas Harris (novel), Ted Tally (screenplay)","Jodie Foster, Lawrence A. Bonney, Kasi Lemmons, Lawrence T. Wrentz","A young F.B.I. cadet must receive the help of an incarcerated and manipulative cannibal killer to help catch another serial killer, a madman who skins his victims.","English, Latin","USA","Won 5 Oscars. Another 63 wins & 51 nominations.","https://m.media-amazon.com/images/M/MV5BNjNhZTk0ZmEtNjJhMi00YzFlLWE1MmEtYzM1M2ZmMGMwMTU4XkEyXkFqcGdeQXVyNjU0OTQ0OTY@._V1_SX300.jpg","Internet Movie Database",8.6,"85","8.6","1,205,175","tt0102926","movie","01 Jul 1998","N/A","Orion Pictures Corporation","N/A","True"
"24","It's a Wonderful Life","1946","Passed","07 Jan 1947","130 min","Drama, Family, Fantasy","Frank Capra","Frances Goodrich (screenplay), Albert Hackett (screenplay), Frank Capra (screenplay), Jo Swerling (additional scenes), Philip Van Doren Stern (story)","James Stewart, Donna Reed, Lionel Barrymore, Thomas Mitchell","An angel is sent from Heaven to help a desperately frustrated businessman by showing him what life would have been like if he had never existed.","English, French","USA","Nominated for 5 Oscars. Another 6 wins & 1 nomination.","https://m.media-amazon.com/images/M/MV5BZjc4NDZhZWMtNGEzYS00ZWU2LThlM2ItNTA0YzQ0OTExMTE2XkEyXkFqcGdeQXVyNjUwMzI2NzU@._V1_SX300.jpg","Internet Movie Database",8.6,"89","8.6","380,786","tt0038650","movie","19 Sep 1995","N/A","Liberty Films","N/A","True"
"25","Star Wars: Episode IV - A New Hope","1977","PG","25 May 1977","121 min","Action, Adventure, Fantasy, Sci-Fi","George Lucas","George Lucas","Mark Hamill, Harrison Ford, Carrie Fisher, Peter Cushing","Luke Skywalker joins forces with a Jedi Knight, a cocky pilot, a Wookiee and two droids to save the galaxy from the Empire's world-destroying battle station, while also attempting to rescue Princess Leia from the mysterious Darth Vader.","English","USA","Won 6 Oscars. Another 52 wins & 28 nominations.","https://m.media-amazon.com/images/M/MV5BNzVlY2MwMjktM2E4OS00Y2Y3LWE3ZjctYzhkZGM3YzA1ZWM2XkEyXkFqcGdeQXVyNzkwMjQ5NzM@._V1_SX300.jpg","Internet Movie Database",8.6,"90","8.6","1,181,083","tt0076759","movie","21 Sep 2004","N/A","20th Century Fox","N/A","True"
"26","Parasite","2019","R","08 Nov 2019","132 min","Comedy, Drama, Thriller","Bong Joon Ho","Bong Joon Ho (story), Bong Joon Ho (screenplay), Jin Won Han (screenplay)","Kang-ho Song, Sun-kyun Lee, Yeo-jeong Jo, Woo-sik Choi","A poor family, the Kims, con their way into becoming the servants of a rich family, the Parks. But their easy life gets complicated when their deception is threatened with exposure.","Korean, English","South Korea","Won 4 Oscars. Another 255 wins & 221 nominations.","https://m.media-amazon.com/images/M/MV5BYWZjMjk3ZTItODQ2ZC00NTY5LWE0ZDYtZTI3MjcwN2Q5NTVkXkEyXkFqcGdeQXVyODk4OTc3MTY@._V1_SX300.jpg","Internet Movie Database",8.6,"96","8.6","355,505","tt6751668","movie","N/A","N/A","N/A","N/A","True"
"27","Saving Private Ryan","1998","R","24 Jul 1998","169 min","Drama, War","Steven Spielberg","Robert Rodat","Tom Hanks, Tom Sizemore, Edward Burns, Barry Pepper","Following the Normandy Landings, a group of U.S. soldiers go behind enemy lines to retrieve a paratrooper whose brothers have been killed in action.","English, French, German, Czech","USA","Won 5 Oscars. Another 74 wins & 74 nominations.","https://m.media-amazon.com/images/M/MV5BZjhkMDM4MWItZTVjOC00ZDRhLThmYTAtM2I5NzBmNmNlMzI1XkEyXkFqcGdeQXVyNDYyMDk5MTU@._V1_SX300.jpg","Internet Movie Database",8.6,"91","8.6","1,178,940","tt0120815","movie","02 Nov 1999","N/A","Dreamworks Distribution","N/A","True"
"28","Spirited Away","2001","PG","28 Mar 2003","125 min","Animation, Adventure, Family, Fantasy, Mystery","Hayao Miyazaki","Hayao Miyazaki","Rumi Hiiragi, Miyu Irino, Mari Natsuki, Takashi Naitô","During her family's move to the suburbs, a sullen 10-year-old girl wanders into a world ruled by gods, witches, and spirits, and where humans are changed into beasts.","Japanese","Japan","Won 1 Oscar. Another 57 wins & 30 nominations.","https://m.media-amazon.com/images/M/MV5BNmU5OTQ0OWQtOTY0OS00Yjg4LWE1NDYtNDRhYWMxYWY4OTMwXkEyXkFqcGdeQXVyNjU0OTQ0OTY@._V1_SX300.jpg","Internet Movie Database",8.6,"96","8.6","598,148","tt0245429","movie","15 Apr 2003","$9,855,615","Walt Disney Pictures","N/A","True"
"29","The Green Mile","1999","R","10 Dec 1999","189 min","Crime, Drama, Fantasy, Mystery","Frank Darabont","Stephen King (novel), Frank Darabont (screenplay)","Tom Hanks, David Morse, Bonnie Hunt, Michael Clarke Duncan","The lives of guards on Death Row are affected by one of their charges: a black man accused of child murder and rape, yet who has a mysterious gift.","English, French","USA","Nominated for 4 Oscars. Another 15 wins & 33 nominations.","https://m.media-amazon.com/images/M/MV5BMTUxMzQyNjA5MF5BMl5BanBnXkFtZTYwOTU2NTY3._V1_SX300.jpg","Internet Movie Database",8.6,"61","8.6","1,083,139","tt0120689","movie","13 Jun 2000","N/A","Warner Bros. Pictures","N/A","True"
"30","Interstellar","2014","PG-13","07 Nov 2014","169 min","Adventure, Drama, Sci-Fi, Thriller","Christopher Nolan","Jonathan Nolan, Christopher Nolan","Ellen Burstyn, Matthew McConaughey, Mackenzie Foy, John Lithgow","A team of explorers travel through a wormhole in space in an attempt to ensure humanity's survival.","English","USA, UK, Canada","Won 1 Oscar. Another 43 wins & 147 nominations.","https://m.media-amazon.com/images/M/MV5BZjdkOTU3MDktN2IxOS00OGEyLWFmMjktY2FiMmZkNWIyODZiXkEyXkFqcGdeQXVyMTMxODk2OTU@._V1_SX300.jpg","Internet Movie Database",8.6,"74","8.6","1,395,990","tt0816692","movie","31 Mar 2015","$158,737,441","Paramount Pictures","N/A","True"
"31","Léon: The Professional","1994","R","18 Nov 1994","110 min","Action, Crime, Drama, Thriller","Luc Besson","Luc Besson","Jean Reno, Gary Oldman, Natalie Portman, Danny Aiello","Mathilda, a 12-year-old girl, is reluctantly taken in by Léon, a professional assassin, after her family is murdered. An unusual relationship forms as she becomes his protégée and learns the assassin's trade.","English, Italian, French","France, USA","6 wins & 14 nominations.","https://m.media-amazon.com/images/M/MV5BZDAwYTlhMDEtNTg0OS00NDY2LWJjOWItNWY3YTZkM2UxYzUzXkEyXkFqcGdeQXVyNTA4NzY1MzY@._V1_SX300.jpg","Internet Movie Database",8.5,"64","8.5","986,202","tt0110413","movie","15 Aug 2000","N/A","Columbia Pictures","N/A","True"
"32","The Usual Suspects","1995","R","16 Aug 1995","106 min","Crime, Mystery, Thriller","Bryan Singer","Christopher McQuarrie","Stephen Baldwin, Gabriel Byrne, Benicio Del Toro, Kevin Pollak","A sole survivor tells of the twisty events leading up to a horrific gun battle on a boat, which began when five criminals met at a seemingly random police lineup.","English, Hungarian, Spanish, French","USA, Germany","Won 2 Oscars. Another 35 wins & 16 nominations.","https://m.media-amazon.com/images/M/MV5BYTViNjMyNmUtNDFkNC00ZDRlLThmMDUtZDU2YWE4NGI2ZjVmXkEyXkFqcGdeQXVyNjU0OTQ0OTY@._V1_SX300.jpg","Internet Movie Database",8.5,"77","8.5","951,109","tt0114814","movie","09 Dec 1999","N/A","Gramercy Pictures","N/A","True"
"33","Harakiri","1962","Not Rated","04 Aug 1964","133 min","Action, Drama, History","Masaki Kobayashi","Yasuhiko Takiguchi (novel), Shinobu Hashimoto (screenplay)","Tatsuya Nakadai, Akira Ishihama, Shima Iwashita, Tetsurô Tanba","When a ronin requesting seppuku at a feudal lord's palace is told of the brutal suicide of another ronin who previously visited, he reveals how their pasts are intertwined - and in doing so challenges the clan's integrity.","Japanese","Japan","8 wins & 2 nominations.","https://m.media-amazon.com/images/M/MV5BYjBmYTQ1NjItZWU5MS00YjI0LTg2OTYtYmFkN2JkMmNiNWVkXkEyXkFqcGdeQXVyMTMxMTY0OTQ@._V1_SX300.jpg","Internet Movie Database",8.7,"85","8.7","33,108","tt0056058","movie","23 Aug 2005","N/A","Criterion Collection","N/A","True"
