"","Title","Year","Rated","Released","Runtime","Genre","Director","Writer","Actors","Plot","Language","Country","Awards","Poster","Ratings.Source","Ratings.Value","Metascore","imdbRating","imdbVotes","imdbID","Type","DVD","BoxOffice","Production","Website","Response"
"171","Stalker","1979","Not Rated","17 Apr 1980","162 min","Drama, Sci-Fi","Andrei Tarkovsky","Arkadiy Strugatskiy (novel), Boris Strugatskiy (novel), Arkadiy Strugatskiy (screenplay), Boris Strugatskiy (screenplay)","Alisa Freyndlikh, Aleksandr Kaydanovskiy, Anatoliy Solonitsyn, Nikolay Grinko","A guide leads two men through an area known as the Zone to find a room that grants wishes.","Russian","Soviet Union","2 wins & 2 nominations.","https://m.media-amazon.com/images/M/MV5BMDgwODNmMGItMDcwYi00OWZjLTgyZjAtMGYwMmI4N2Q0NmJmXkEyXkFqcGdeQXVyNzY1MTU0Njk@._V1_SX300.jpg","Internet Movie Database",8.2,"N/A","8.2","107,511","tt0079944","movie","15 Oct 2002","$268,101","Zweites Deutsches Fernsehen","N/A","True"
"172","The Third Man","1949","Not Rated","12 Oct 1949","93 min","Film-Noir, Mystery, Thriller","Carol Reed","Graham Greene (by), Graham Greene (screen play)","Joseph Cotten, Alida Valli, Orson Welles, Trevor Howard","Pulp novelist Holly Martins travels to shadowy, postwar Vienna, only to find himself investigating the mysterious death of an old friend, Harry Lime.","English, German, Russian","UK","Won 1 Oscar. Another 4 wins & 4 nominations.","https://m.media-amazon.com/images/M/MV5BYjE2OTdhMWUtOGJlMy00ZDViLWIzZjgtYjZkZGZmMDZjYmEyXkEyXkFqcGdeQXVyNzkwMjQ5NzM@._V1_SX300.jpg","Internet Movie Database",8.1,"97","8.1","151,235","tt0041959","movie","N/A","N/A","N/A","N/A","True"
"173","On the Waterfront","1954","Not Rated","22 Jun 1954","108 min","Crime, Drama, Thriller","Elia Kazan","Budd Schulberg (screenplay), Budd Schulberg (based upon an original story by), Malcolm Johnson (suggested by articles by)","Marlon Brando, Karl Malden, Lee J. Cobb, Rod Steiger","An ex-prize fighter turned longshoreman struggles to stand up to his corrupt union bosses.","English","USA","Won 8 Oscars. Another 21 wins & 9 nominations.","https://m.media-amazon.com/images/M/MV5BY2I0MWFiZDMtNWQyYy00Njk5LTk3MDktZjZjNTNmZmVkYjkxXkEyXkFqcGdeQXVyNjc1NTYyMjg@._V1_SX300.jpg","Internet Movie Database",8.1,"91","8.1","135,223","tt0047296","movie","23 Oct 2001","N/A","Sony Pictures","N/A","True"
"174","Fargo","1996","R","05 Apr 1996","98 min","Crime, Drama, Thriller","Joel Coen, Ethan Coen","Ethan Coen, Joel Coen","William H. Macy, Steve Buscemi, Peter Stormare, Kristin Rudrüd","Jerry Lundegaard's inept crime falls apart due to his and his henchmen's bungling and the persistent police work of the quite pregnant Marge Gunderson.","English","USA, UK","Won 2 Oscars. Another 81 wins & 57 nominations.","https://m.media-amazon.com/images/M/MV5BNDJiZDgyZjctYmRjMS00ZjdkLTkwMTEtNGU1NDg3NDQ0Yzk1XkEyXkFqcGdeQXVyNzkwMjQ5NzM@._V1_SX300.jpg","Internet Movie Database",8.1,"85","8.1","589,534","tt0116282","movie","24 Jun 1997","N/A","Gramercy Pictures","N/A","True"
"175","Kill Bill: Vol. 1","2003","R","10 Oct 2003","111 min","Action, Crime, Thriller","Quentin Tarantino","Quentin Tarantino, Quentin Tarantino (character The Bride), Uma Thurman (character The Bride)","Uma Thurman, Lucy Liu, Vivica A. Fox, Daryl Hannah","After awakening from a four-year coma, a former assassin wreaks vengeance on the team of assassins who betrayed her.","English, Japanese, French","USA, Japan","Nominated for 1 Golden Globe. Another 28 wins & 101 nominations.","https://m.media-amazon.com/images/M/MV5BNzM3NDFhYTAtYmU5Mi00NGRmLTljYjgtMDkyODQ4MjNkMGY2XkEyXkFqcGdeQXVyNzkwMjQ5NzM@._V1_SX300.jpg","Internet Movie Database",8.1,"69","8.1","952,398","tt0266697","movie","13 Apr 2004","N/A","Miramax Films","N/A","True"
"176","The Truman Show","1998","PG","05 Jun 1998","103 min","Comedy, Drama, Sci-Fi","Peter Weir","Andrew Niccol","Jim Carrey, Laura Linney, Noah Emmerich, Natascha McElhone","An insurance salesman discovers his whole life is actually a reality TV show.","English","USA","Nominated for 3 Oscars. Another 40 wins & 65 nominations.","https://m.media-amazon.com/images/M/MV5BMDIzODcyY2EtMmY2MC00ZWVlLTgwMzAtMjQwOWUyNmJjNTYyXkEyXkFqcGdeQXVyNDk3NzU2MTQ@._V1_SX300.jpg","Internet Movie Database",8.1,"90","8.1","881,234","tt0120382","movie","26 Jan 1999","N/A","Paramount Pictures","N/A","True"
"177","Gran Torino","2008","R","09 Jan 2009","116 min","Drama","Clint Eastwood","Nick Schenk (screenplay), Dave Johannson (story), Nick Schenk (story)","Clint Eastwood, Christopher Carley, Bee Vang, Ahney Her","Disgruntled Korean War veteran Walt Kowalski sets out to reform his neighbor, Thao Lor, a Hmong teenager who tried to steal Kowalski's prized possession: a 1972 Gran Torino.","English, Hmong","Germany, USA","Nominated for 1 Golden Globe. Another 21 wins & 20 nominations.","https://m.media-amazon.com/images/M/MV5BMTc5NTk2OTU1Nl5BMl5BanBnXkFtZTcwMDc3NjAwMg@@._V1_SX300.jpg","Internet Movie Database",8.1,"72","8.1","696,337","tt1205489","movie","09 Jun 2009","$148,055,047","Warner Bros. Pictures/Village Roadshow","N/A","True"
"178","Tokyo Story","1953","Not Rated","13 Mar 1972","136 min","Drama","Yasujirô Ozu","Kôgo Noda (scenario), Yasujirô Ozu (scenario)","Chishû Ryû, Chieko Higashiyama, Setsuko Hara, Haruko Sugimura","An old couple visit their children and grandchildren in the city, but receive little attention.","Japanese, English","Japan","3 wins.","https://m.media-amazon.com/images/M/MV5BYWQ4ZTRiODktNjAzZC00Nzg1LTk1YWQtNDFmNDI0NmZiNGIwXkEyXkFqcGdeQXVyNzkwMjQ5NzM@._V1_SX300.jpg","Internet Movie Database",8.2,"N/A","8.2","47,523","tt0046438","movie","30 Oct 2003","N/A","BFI Production","N/A","True"
"179","The Deer Hunter","1978","R","23 Feb 1979","183 min","Drama, War","Michael Cimino","Michael Cimino (story), Deric Washburn (story), Louis Garfinkle (story), Quinn K. Redeker (story), Deric Washburn (screenplay)","Robert De Niro, John Cazale, John Savage, Christopher Walken","An in-depth examination of the ways in which the U.S. Vietnam War impacts and disrupts the lives of people in a small industrial town in Pennsylvania.","English, Russian, Vietnamese, French","USA","Won 5 Oscars. Another 17 wins & 26 nominations.","https://m.media-amazon.com/images/M/MV5BNDhmNTA0ZDMtYjhkNS00NzEzLWIzYTItOGNkMTVmYjE2YmI3XkEyXkFqcGdeQXVyNzkwMjQ5NzM@._V1_SX300.jpg","Internet Movie Database",8.1,"86","8.1","296,382","tt0077416","movie","06 Sep 2005","N/A","Universal Pictures","N/A","True"
"180","Memories of Murder","2003","Not Rated","02 May 2003","132 min","Action, Crime, Drama, Mystery, Thriller","Bong Joon Ho","Bong Joon Ho, Kwang-rim Kim (play), Sung-bo Shim","Kang-ho Song, Sang-kyung Kim, Roe-ha Kim, Jae-ho Song","In a small Korean province in 1986, two detectives struggle with the case of multiple young women being found raped and murdered by an unknown culprit.","Korean, English","South Korea","26 wins & 3 nominations.","https://m.media-amazon.com/images/M/MV5BMzhlNGJhYzUtZTNiMi00MjI0LWFjN2MtOTVlN2IxODVkZWVkXkEyXkFqcGdeQXVyMTMxODk2OTU@._V1_SX300.jpg","Internet Movie Database",8.1,"82","8.1","119,788","tt0353969","movie","12 Jun 1991","N/A","Houston Lady Productions","N/A","True"
"181","Wild Tales","2014","R","21 Aug 2014","122 min","Comedy, Drama, Thriller","Damián Szifron","Germán Servidio (collaborating writer), Damián Szifron","Darío Grandinetti, María Marull, Mónica Villa, Diego Starosta","Six short stories that explore the extremities of human behavior involving people in distress.","Spanish","Argentina, Spain, France, UK","Nominated for 1 Oscar. Another 48 wins & 54 nominations.","https://m.media-amazon.com/images/M/MV5BNGQzY2Y0MTgtMDA4OC00NjM3LWI0ZGQtNTJlM2UxZDQxZjI0XkEyXkFqcGdeQXVyNDUzOTQ5MjY@._V1_SX300.jpg","Internet Movie Database",8.1,"77","8.1","164,631","tt3011894","movie","16 Jun 2015","N/A","Sony Pictures Classics","N/A","True"
"182","Klaus","2019","PG","15 Nov 2019","96 min","Animation, Adventure, Comedy, Family","Sergio Pablos, Carlos Martínez López(co-director)","Sergio Pablos (original story by), Sergio Pablos (screenplay by), Jim Mahoney (screenplay by), Zach Lewis (screenplay by)","Jason Schwartzman, J.K. Simmons, Rashida Jones, Will Sasso","A simple act of kindness always sparks another, even in a frozen, faraway place. When Smeerensburg's new postman, Jesper, befriends toymaker Klaus, their gifts melt an age-old feud and deliver a sleigh full of holiday traditions.","English, Saami","Spain","Nominated for 1 Oscar. Another 8 wins & 18 nominations.","https://m.media-amazon.com/images/M/MV5BMWYwOThjM2ItZGYxNy00NTQwLWFlZWEtM2MzM2Q5MmY3NDU5XkEyXkFqcGdeQXVyMTkxNjUyNQ@@._V1_SX300.jpg","Internet Movie Database",8.2,"65","8.2","65,797","tt4729430","movie","N/A","N/A","N/A","N/A","True"
"183","Andhadhun","2018","Not Rated","05 Oct 2018","139 min","Crime, Thriller","Sriram Raghavan","Arijit Biswas, Yogesh Chandekar, Sriram Raghavan, Hemanth M. Rao, Pooja Ladha Surti, Olivier Treiner (based on the story by)","Ayushmann Khurrana, Tabu, Radhika Apte, Anil Dhawan","A series of mysterious events change the life of a blind pianist, who must now report a crime that he should technically know nothing of.","Hindi, English","India","25 wins & 25 nominations.","https://m.media-amazon.com/images/M/MV5BZWZhMjhhZmYtOTIzOC00MGYzLWI1OGYtM2ZkN2IxNTI4ZWI3XkEyXkFqcGdeQXVyNDAzNDk0MTQ@._V1_SX300.jpg","Internet Movie Database",8.3,"N/A","8.3","58,260","tt8108198","movie","N/A","N/A","Viacom 18 Motion Pictures","N/A","True"
"184","The Bandit","1996","TV-MA","29 Nov 1996","128 min","Crime, Drama, Thriller","Yavuz Turgul","Yavuz Turgul","Sener Sen, Ugur Yücel, Sermin Hürmeriç, Yesim Salkim","Baran the Bandit, released from prison after 35 years, searches for vengeance and his lover.","Turkish","Turkey, France, Bulgaria","2 wins.","https://m.media-amazon.com/images/M/MV5BOGQ4ZjFmYjktOGNkNS00OWYyLWIyZjgtMGJjM2U1ZTA0ZTlhXkEyXkFqcGdeQXVyNTA4NzY1MzY@._V1_SX300.jpg","Internet Movie Database",8.3,"N/A","8.3","59,278","tt0116231","movie","N/A","N/A","N/A","N/A","True"
"185","The Big Lebowski","1998","R","06 Mar 1998","117 min","Comedy, Crime, Sport","Joel Coen, Ethan Coen","Ethan Coen, Joel Coen","Jeff Bridges, John Goodman, Julianne Moore, Steve Buscemi","Jeff ""The Dude"" Lebowski, mistaken for a millionaire of the same name, seeks restitution for his ruined rug and enlists his bowling buddies to help get it.","English, German, Hebrew, Spanish","USA, UK","5 wins & 17 nominations.","https://m.media-amazon.com/images/M/MV5BMTQ0NjUzMDMyOF5BMl5BanBnXkFtZTgwODA1OTU0MDE@._V1_SX300.jpg","Internet Movie Database",8.1,"71","8.1","697,372","tt0118715","movie","27 Oct 1998","N/A","Gramercy Pictures","N/A","True"
"186","Mary and Max","2009","Not Rated","09 Apr 2009","92 min","Animation, Comedy, Drama, Family","Adam Elliot","Adam Elliot","Christopher Massey, Oliver Marks, Daisy Kocher, Daniel Marks","A tale of friendship between two unlikely pen pals: Mary, a lonely, eight-year-old girl living in the suburbs of Melbourne, and Max, a forty-four-year old, severely obese man living in New York.","English, Yiddish","Australia","4 wins & 9 nominations.","https://m.media-amazon.com/images/M/MV5BMDgzYjQwMDMtNGUzYi00MTRmLWIyMGMtNjE1OGZkNzY2YWIzL2ltYWdlXkEyXkFqcGdeQXVyNjU0OTQ0OTY@._V1_SX300.jpg","Internet Movie Database",8.1,"N/A","8.1","156,995","tt0978762","movie","15 Jun 2010","N/A","IFC Films","N/A","True"
"187","In the Name of the Father","1993","R","25 Feb 1994","133 min","Biography, Drama","Jim Sheridan","Gerry Conlon (autobiographical book ""Proved Innocent""), Terry George (screenplay), Jim Sheridan (screenplay)","Alison Crosbie, Daniel Day-Lewis, Philip King, Emma Thompson","A man's coerced confession to an I.R.A. bombing he did not commit results in the imprisonment of his father as well. An English lawyer fights to free them.","English","Ireland, UK","Nominated for 7 Oscars. Another 7 wins & 34 nominations.","https://m.media-amazon.com/images/M/MV5BMmYyOTgwYWItYmU3Ny00M2E2LTk0NWMtMDVlNmQ0MWZiMTMxXkEyXkFqcGdeQXVyNzkwMjQ5NzM@._V1_SX300.jpg","Internet Movie Database",8.1,"84","8.1","147,872","tt0107207","movie","07 Jul 1998","N/A","Universal Pictures","N/A","True"
"188","Gone Girl","2014","R","03 Oct 2014","149 min","Drama, Mystery, Thriller","David Fincher","Gillian Flynn (screenplay), Gillian Flynn (novel)","Ben Affleck, Rosamund Pike, Neil Patrick Harris, Tyler Perry","With his wife's disappearance having become the focus of an intense media circus, a man sees the spotlight turned on him when it's suspected that he may not be innocent.","English","USA","Nominated for 1 Oscar. Another 64 wins & 183 nominations.","https://m.media-amazon.com/images/M/MV5BMTk0MDQ3MzAzOV5BMl5BanBnXkFtZTgwNzU1NzE3MjE@._V1_SX300.jpg","Internet Movie Database",8.1,"79","8.1","810,958","tt2267998","movie","13 Jan 2015","N/A","20th Century Fox","N/A","True"
"189","Hacksaw Ridge","2016","R","04 Nov 2016","139 min","Biography, Drama, History, War","Mel Gibson","Robert Schenkkan (screenplay by), Andrew Knight (screenplay by)","Andrew Garfield, Richard Pyros, Jacob Warner, Milo Gibson","World War II American Army Medic Desmond T. Doss, who served during the Battle of Okinawa, refuses to kill people, and becomes the first man in American history to receive the Medal of Honor without firing a shot.","English, Japanese","Australia, USA","Won 2 Oscars. Another 51 wins & 114 nominations.","https://m.media-amazon.com/images/M/MV5BMjQ1NjM3MTUxNV5BMl5BanBnXkFtZTgwMDc5MTY5OTE@._V1_SX300.jpg","Internet Movie Database",8.1,"71","8.1","404,082","tt2119532","movie","N/A","N/A","N/A","N/A","True"
"190","The Grand Budapest Hotel","2014","R","28 Mar 2014","99 min","Adventure, Comedy, Crime","Wes Anderson","Stefan Zweig (inspired by the writings of), Wes Anderson (screenplay), Wes Anderson (story), Hugo Guinness (story)","Ralph Fiennes, F. Murray Abraham, Mathieu Amalric, Adrien Brody","A writer encounters the owner of an aging high-class hotel, who tells him of his early years serving as a lobby boy in the hotel's glorious years under an exceptional concierge.","English, French, German","Germany, USA","Won 4 Oscars. Another 130 wins & 225 nominations.","https://m.media-amazon.com/images/M/MV5BMzM5NjUxOTEyMl5BMl5BanBnXkFtZTgwNjEyMDM0MDE@._V1_SX300.jpg","Internet Movie Database",8.1,"88","8.1","666,274","tt2278388","movie","17 Jun 2014","$56,939,515","Fox Searchlight","N/A","True"
"191","Ford v Ferrari","2019","PG-13","15 Nov 2019","152 min","Action, Biography, Drama, Sport","James Mangold","Jez Butterworth, John-Henry Butterworth, Jason Keller","Matt Damon, Christian Bale, Jon Bernthal, Caitriona Balfe","American car designer Carroll Shelby and driver Ken Miles battle corporate interference and the laws of physics to build a revolutionary race car for Ford in order to defeat Ferrari at the 24 Hours of Le Mans in 1966.","English, Italian, French, Japanese","USA, France","Won 2 Oscars. Another 21 wins & 73 nominations.","https://m.media-amazon.com/images/M/MV5BM2UwMDVmMDItM2I2Yi00NGZmLTk4ZTUtY2JjNTQ3OGQ5ZjM2XkEyXkFqcGdeQXVyMTA1OTYzOTUx._V1_SX300.jpg","Internet Movie Database",8.1,"81","8.1","203,515","tt1950186","movie","N/A","N/A","20th Century Fox","N/A","True"
"192","Persona","1966","Not Rated","16 Mar 1967","83 min","Drama, Thriller","Ingmar Bergman","Ingmar Bergman (story and screenplay)","Bibi Andersson, Liv Ullmann, Margaretha Krook, Gunnar Björnstrand","A nurse is put in charge of a mute actress and finds that their personae are melding together.","Swedish, English","Sweden","Nominated for 1 BAFTA Film Award. Another 7 wins & 4 nominations.","https://m.media-amazon.com/images/M/MV5BMTM0YzExY2EtMjUyZi00ZmIwLWFkYTktNjY5NmVkYTdkMjI5XkEyXkFqcGdeQXVyNzQxNDExNTU@._V1_SX300.jpg","Internet Movie Database",8.1,"86","8.1","93,493","tt0060827","movie","16 Mar 2004","N/A","Criterion Collection","N/A","True"
"193","Before Sunrise","1995","R","27 Jan 1995","101 min","Drama, Romance","Richard Linklater","Richard Linklater, Kim Krizan","Ethan Hawke, Julie Delpy, Andrea Eckert, Hanno Pöschl","A young man and woman meet on a train in Europe, and wind up spending one evening together in Vienna. Unfortunately, both know that this will probably be their only night together.","English, German, French","USA, Austria, Switzerland","1 win & 7 nominations.","https://m.media-amazon.com/images/M/MV5BZDdiZTAwYzAtMDI3Ni00OTRjLTkzN2UtMGE3MDMyZmU4NTU4XkEyXkFqcGdeQXVyNjU0OTQ0OTY@._V1_SX300.jpg","Internet Movie Database",8.1,"77","8.1","253,548","tt0112471","movie","30 Nov 1999","N/A","Sony Pictures","N/A","True"
"194","Catch Me If You Can","2002","PG-13","25 Dec 2002","141 min","Biography, Crime, Drama","Steven Spielberg","Jeff Nathanson (screenplay), Frank Abagnale Jr. (book), Stan Redding (book)","Leonardo DiCaprio, Tom Hanks, Christopher Walken, Martin Sheen","A seasoned FBI agent pursues Frank Abagnale Jr. who, before his 19th birthday, successfully forged millions of dollars' worth of checks while posing as a Pan Am pilot, a doctor, and a legal prosecutor.","English, French","USA, Canada","Nominated for 2 Oscars. Another 16 wins & 44 nominations.","https://m.media-amazon.com/images/M/MV5BMTY5MzYzNjc5NV5BMl5BanBnXkFtZTYwNTUyNTc2._V1_SX300.jpg","Internet Movie Database",8.1,"75","8.1","778,267","tt0264464","movie","06 May 2003","$164,400,000","DreamWorks SKG","N/A","True"
"195","How to Train Your Dragon","2010","PG","26 Mar 2010","98 min","Animation, Action, Adventure, Family, Fantasy","Dean DeBlois, Chris Sanders","William Davies (screenplay by), Dean DeBlois (screenplay by), Chris Sanders (screenplay by), Cressida Cowell (based on the book by), Marc Hyman (collaborating writer)","Jay Baruchel, Gerard Butler, Craig Ferguson, America Ferrera","A hapless young Viking who aspires to hunt dragons becomes the unlikely friend of a young dragon himself, and learns there may be more to the creatures than he assumed.","English","USA","Nominated for 2 Oscars. Another 25 wins & 60 nominations.","https://m.media-amazon.com/images/M/MV5BMjA5NDQyMjc2NF5BMl5BanBnXkFtZTcwMjg5ODcyMw@@._V1_SX300.jpg","Internet Movie Database",8.1,"75","8.1","637,244","tt0892769","movie","15 Oct 2010","$216,900,000","Paramount/DWA","N/A","True"
"196","The General","1926","Passed","02 Jan 1927","67 min","Action, Adventure, Comedy, Drama, War","Clyde Bruckman, Buster Keaton","Buster Keaton, Clyde Bruckman, Al Boasberg (adapted by), Charles Henry Smith (adapted by)","Marion Mack, Glen Cavender, Jim Farley, Frederick Vroom","When Union spies steal an engineer's beloved locomotive, he pursues it single-handedly and straight through enemy lines.","English","USA","2 wins & 1 nomination.","https://m.media-amazon.com/images/M/MV5BYmRiMDFlYjYtOTMwYy00OGY2LWE0Y2QtYzQxOGNhZmUwNTIxXkEyXkFqcGdeQXVyNzkwMjQ5NzM@._V1_SX300.jpg","Internet Movie Database",8.1,"N/A","8.1","75,632","tt0017925","movie","26 Oct 1999","N/A","United Artists Films","N/A","True"
"197","Mr. Smith Goes to Washington","1939","Not Rated","19 Oct 1939","129 min","Comedy, Drama","Frank Capra","Sidney Buchman (screen play), Lewis R. Foster (story)","Jean Arthur, James Stewart, Claude Rains, Edward Arnold","A naive man is appointed to fill a vacancy in the United States Senate. His plans promptly collide with political corruption, but he doesn't back down.","English","USA","Won 1 Oscar. Another 5 wins & 16 nominations.","https://m.media-amazon.com/images/M/MV5BZTYwYjYxYzgtMDE1Ni00NzU4LWJlMTEtODQ5YmJmMGJhZjI5L2ltYWdlXkEyXkFqcGdeQXVyMDI2NDg0NQ@@._V1_SX300.jpg","Internet Movie Database",8.1,"73","8.1","101,146","tt0031679","movie","21 Aug 2007","N/A","ITVS","N/A","True"
"198","Sherlock Jr.","1924","Not Rated","11 May 1924","45 min","Action, Comedy, Romance","Buster Keaton","Jean C. Havez (story), Joseph A. Mitchell (story), Clyde Bruckman (story)","Buster Keaton, Kathryn McGuire, Joe Keaton, Erwin Connelly","A film projectionist longs to be a detective, and puts his meagre skills to work when he is framed by a rival for stealing his girlfriend's father's pocketwatch.","English","USA","1 win.","https://m.media-amazon.com/images/M/MV5BZWFhOGU5NDctY2Q3YS00Y2VlLWI1NzEtZmIwY2ZiZjY4OTA2XkEyXkFqcGdeQXVyMDI2NDg0NQ@@._V1_SX300.jpg","Internet Movie Database",8.2,"N/A","8.2","36,877","tt0015324","movie","08 Oct 2013","N/A","Metro Pictures Corporation","N/A","True"
"199","Prisoners","2013","R","20 Sep 2013","153 min","Crime, Drama, Mystery, Thriller","Denis Villeneuve","Aaron Guzikowski","Hugh Jackman, Jake Gyllenhaal, Viola Davis, Maria Bello","When Keller Dover's daughter and her friend go missing, he takes matters into his own hands as the police pursue multiple leads and the pressure mounts.","English","USA","Nominated for 1 Oscar. Another 10 wins & 37 nominations.","https://m.media-amazon.com/images/M/MV5BMTg0NTIzMjQ1NV5BMl5BanBnXkFtZTcwNDc3MzM5OQ@@._V1_SX300.jpg","Internet Movie Database",8.1,"70","8.1","563,795","tt1392214","movie","17 Dec 2013","$60,962,878","Warner Bros.","N/A","True"
"200","12 Years a Slave","2013","R","08 Nov 2013","134 min","Biography, Drama, History","Steve McQueen","John Ridley (screenplay by), Solomon Northup (based on ""Twelve Years a Slave"" by)","Chiwetel Ejiofor, Dwight Henry, Dickie Gravois, Bryan Batt","In the antebellum United States, Solomon Northup, a free black man from upstate New York, is abducted and sold into slavery.","English","UK, USA","Won 3 Oscars. Another 238 wins & 335 nominations.","https://m.media-amazon.com/images/M/MV5BMjExMTEzODkyN15BMl5BanBnXkFtZTcwNTU4NTc4OQ@@._V1_SX300.jpg","Internet Movie Database",8.1,"96","8.1","608,510","tt2024544","movie","04 Mar 2014","$50,628,650","Fox Searchlight","N/A","True"
"201","Cool Hand Luke","1967","GP","01 Nov 1967","127 min","Crime, Drama","Stuart Rosenberg","Donn Pearce (screenplay), Frank Pierson (screenplay), Donn Pearce (novel)","Paul Newman, George Kennedy, J.D. Cannon, Lou Antonio","A laid back Southern man is sentenced to two years in a rural prison, but refuses to conform.","English","USA","Won 1 Oscar. Another 3 wins & 10 nominations.","https://m.media-amazon.com/images/M/MV5BOWFlNzZhYmYtYTI5YS00MDQyLWIyNTUtNTRjMWUwNTEzNjA0XkEyXkFqcGdeQXVyNjUwNzk3NDc@._V1_SX300.jpg","Internet Movie Database",8.1,"91","8.1","154,607","tt0061512","movie","03 Nov 1997","N/A","Warner Bros.","N/A","True"
"202","Mad Max: Fury Road","2015","R","15 May 2015","120 min","Action, Adventure, Sci-Fi, Thriller","George Miller","George Miller, Brendan McCarthy, Nick Lathouris","Tom Hardy, Charlize Theron, Nicholas Hoult, Hugh Keays-Byrne","In a post-apocalyptic wasteland, a woman rebels against a tyrannical ruler in search for her homeland with the aid of a group of female prisoners, a psychotic worshiper, and a drifter named Max.","English, Russian","Australia, USA, South Africa","Won 6 Oscars. Another 236 wins & 228 nominations.","https://m.media-amazon.com/images/M/MV5BN2EwM2I5OWMtMGQyMi00Zjg1LWJkNTctZTdjYTA4OGUwZjMyXkEyXkFqcGdeQXVyMTMxODk2OTU@._V1_SX300.jpg","Internet Movie Database",8.1,"90","8.1","827,543","tt1392190","movie","01 Sep 2015","$129,483,877","Warner Bros.","N/A","True"
"203","Barry Lyndon","1975","PG","18 Dec 1975","185 min","Adventure, Drama, History, War","Stanley Kubrick","Stanley Kubrick (written for the screen by), William Makepeace Thackeray (novel)","Ryan O'Neal, Marisa Berenson, Patrick Magee, Hardy Krüger","An Irish rogue wins the heart of a rich widow and assumes her dead husband's aristocratic position in 18th-century England.","English, German, French","UK, USA","Won 4 Oscars. Another 13 wins & 14 nominations.","https://m.media-amazon.com/images/M/MV5BNmY0MWY2NDctZDdmMi00MjA1LTk0ZTQtZDMyZTQ1NTNlYzVjXkEyXkFqcGdeQXVyMjUzOTY1NTc@._V1_SX300.jpg","Internet Movie Database",8.1,"89","8.1","141,423","tt0072684","movie","29 Jun 1999","N/A","Warner Bros.","N/A","True"
"204","Network","1976","R","27 Nov 1976","121 min","Drama","Sidney Lumet","Paddy Chayefsky","Faye Dunaway, William Holden, Peter Finch, Robert Duvall","A television network cynically exploits a deranged former anchor's ravings and revelations about the news media for its own profit.","English","USA","Won 4 Oscars. Another 16 wins & 26 nominations.","https://m.media-amazon.com/images/M/MV5BNmFiOWY3ZTktOTYwNy00ZTUzLTk0ODQtNzIxMzQ0ZDFjMTgyXkEyXkFqcGdeQXVyNTc1NTQxODI@._V1_SX300.jpg","Internet Movie Database",8.1,"83","8.1","137,844","tt0074958","movie","16 May 2000","N/A","MGM/United Artists","N/A","True"
"205","The Wages of Fear","1953","Not Rated","16 Feb 1955","131 min","Adventure, Drama, Thriller","Henri-Georges Clouzot","Georges Arnaud (novel), Henri-Georges Clouzot (adaptation), Jérôme Géronimi (adaptation)","Yves Montand, Charles Vanel, Folco Lulli, Peter van Eyck","In a decrepit South American village, four men are hired to transport an urgent nitroglycerine shipment without the equipment that would make it safe.","French, English, Spanish, German, Italian, Russian","France, Italy","Won 1 BAFTA Film Award. Another 5 wins.","https://m.media-amazon.com/images/M/MV5BZDdkNzMwZmUtY2Q5MS00ZmM2LWJhYjItYTBjMWY0MGM4MDRjXkEyXkFqcGdeQXVyNTA4NzY1MzY@._V1_SX300.jpg","Internet Movie Database",8.1,"N/A","8.1","51,396","tt0046268","movie","26 Jan 1999","N/A","Janus Films","N/A","True"
"206","Stand by Me","1986","R","26 Nov 1986","89 min","Adventure, Drama","Rob Reiner","Stephen King (novel), Raynold Gideon (screenplay), Bruce A. Evans (screenplay)","Wil Wheaton, River Phoenix, Corey Feldman, Jerry O'Connell","After the death of one of his friends, a writer recounts a boyhood journey with his friends to find the body of a missing boy.","English","USA","Nominated for 1 Oscar. Another 5 wins & 10 nominations.","https://m.media-amazon.com/images/M/MV5BODJmY2Y2OGQtMDg2My00N2Q3LWJmZTUtYTc2ODBjZDVlNDlhXkEyXkFqcGdeQXVyMTQxNzMzNDI@._V1_SX300.jpg","Internet Movie Database",8.1,"75","8.1","347,108","tt0092005","movie","29 Aug 2000","N/A","MCA Universal Home Video","N/A","True"
