"","Title","Year","Rated","Released","Runtime","Genre","Director","Writer","Actors","Plot","Language","Country","Awards","Poster","Ratings.Source","Ratings.Value","Metascore","imdbRating","imdbVotes","imdbID","Type","DVD","BoxOffice","Production","Website","Response"
"135","Ran","1985","R","01 Jun 1985","162 min","Action, Drama, War","Akira Kurosawa","Akira Kurosawa (screenplay), Hideo Oguni (screenplay), Masato Ide (screenplay), William Shakespeare (play)","Tatsuya Nakadai, Akira Terao, Jinpachi Nezu, Daisuke Ryû","In Medieval Japan, an elderly warlord retires, handing over his empire to his three sons. However, he vastly underestimates how the new-found power will corrupt them and cause them to turn on each other...and him.","Japanese","Japan, France","Won 1 Oscar. Another 29 wins & 22 nominations.","https://m.media-amazon.com/images/M/MV5BZDBjZTM4ZmEtOTA5ZC00NTQzLTkyNzYtMmUxNGU2YjI5YjU5L2ltYWdlXkEyXkFqcGdeQXVyNTAyODkwOQ@@._V1_SX300.jpg","Internet Movie Database",8.2,"96","8.2","105,160","tt0089881","movie","22 Nov 2005","N/A","Rialto Pictures","N/A","True"
"136","The Great Escape","1963","Not Rated","04 Jul 1963","172 min","Adventure, Drama, History, Thriller, War","John Sturges","Paul Brickhill (book), James Clavell (screenplay), W.R. Burnett (screenplay)","Steve McQueen, James Garner, Richard Attenborough, James Donald","Allied prisoners of war plan for several hundred of their number to escape from a German camp during World War II.","English, German, French, Russian, Spanish","USA","Nominated for 1 Oscar. Another 2 wins & 10 nominations.","https://m.media-amazon.com/images/M/MV5BNzA2NmYxMWUtNzBlMC00MWM2LTkwNmQtYTFlZjQwODNhOWE0XkEyXkFqcGdeQXVyNTIzOTk5ODM@._V1_SX300.jpg","Internet Movie Database",8.2,"87","8.2","213,401","tt0057115","movie","31 Mar 1998","N/A","United Artists","N/A","True"
"137","All About Eve","1950","Passed","27 Oct 1950","138 min","Drama","Joseph L. Mankiewicz","Joseph L. Mankiewicz (written for the screen by)","Bette Davis, Anne Baxter, George Sanders, Celeste Holm","An ingénue insinuates herself into the lives of an established but aging stage actress and her circle of theater friends.","English, French","USA","Won 6 Oscars. Another 17 wins & 18 nominations.","https://m.media-amazon.com/images/M/MV5BMTY2MTAzODI5NV5BMl5BanBnXkFtZTgwMjM4NzQ0MjE@._V1_SX300.jpg","Internet Movie Database",8.2,"98","8.2","114,294","tt0042192","movie","05 Oct 1999","N/A","20th Century Fox","N/A","True"
"138","A Beautiful Mind","2001","PG-13","04 Jan 2002","135 min","Biography, Drama","Ron Howard","Akiva Goldsman, Sylvia Nasar (book)","Russell Crowe, Ed Harris, Jennifer Connelly, Christopher Plummer","After John Nash, a brilliant but asocial mathematician, accepts secret work in cryptography, his life takes a turn for the nightmarish.","English","USA","Won 4 Oscars. Another 33 wins & 68 nominations.","https://m.media-amazon.com/images/M/MV5BMzcwYWFkYzktZjAzNC00OGY1LWI4YTgtNzc5MzVjMDVmNjY0XkEyXkFqcGdeQXVyMTQxNzMzNDI@._V1_SX300.jpg","Internet Movie Database",8.2,"72","8.2","812,723","tt0268978","movie","25 Jun 2002","N/A","Universal Pictures","N/A","True"
"139","Casino","1995","R","22 Nov 1995","178 min","Crime, Drama","Martin Scorsese","Nicholas Pileggi (book), Nicholas Pileggi (screenplay), Martin Scorsese (screenplay)","Robert De Niro, Sharon Stone, Joe Pesci, James Woods","A tale of greed, deception, money, power, and murder occur between two best friends: a mafia enforcer and a casino executive, compete against each other over a gambling empire, and over a fast living and fast loving socialite.","English","France, USA","Nominated for 1 Oscar. Another 4 wins & 10 nominations.","https://m.media-amazon.com/images/M/MV5BMTcxOWYzNDYtYmM4YS00N2NkLTk0NTAtNjg1ODgwZjAxYzI3XkEyXkFqcGdeQXVyNTA4NzY1MzY@._V1_SX300.jpg","Internet Movie Database",8.2,"73","8.2","441,202","tt0112641","movie","24 Feb 1998","N/A","Universal Pictures","N/A","True"
"140","Pan's Labyrinth","2006","R","19 Jan 2007","118 min","Drama, Fantasy, War","Guillermo del Toro","Guillermo del Toro","Ivana Baquero, Sergi López, Maribel Verdú, Doug Jones","In the Falangist Spain of 1944, the bookish young stepdaughter of a sadistic army officer escapes into an eerie but captivating fantasy world.","Spanish","Mexico, Spain","Won 3 Oscars. Another 103 wins & 110 nominations.","https://m.media-amazon.com/images/M/MV5BMTU3ODg2NjQ5NF5BMl5BanBnXkFtZTcwMDEwODgzMQ@@._V1_SX300.jpg","Internet Movie Database",8.2,"98","8.2","597,196","tt0457430","movie","18 May 2007","$37,500,000","Picturehouse","N/A","True"
"141","My Neighbor Totoro","1988","G","13 Jul 1990","86 min","Animation, Family, Fantasy","Hayao Miyazaki","Hayao Miyazaki","Noriko Hidaka, Chika Sakamoto, Shigesato Itoi, Sumi Shimamoto","When two girls move to the country to be near their ailing mother, they have adventures with the wondrous forest spirits who live nearby.","Japanese","Japan","5 wins & 2 nominations.","https://m.media-amazon.com/images/M/MV5BYzJjMTYyMjQtZDI0My00ZjE2LTkyNGYtOTllNGQxNDMyZjE0XkEyXkFqcGdeQXVyMTMxODk2OTU@._V1_SX300.jpg","Internet Movie Database",8.2,"86","8.2","264,873","tt0096283","movie","07 Mar 2006","N/A","Tokuma Shoten","N/A","True"
"142","The Secret in Their Eyes","2009","R","21 May 2010","129 min","Drama, Mystery, Romance, Thriller","Juan José Campanella","Eduardo Sacheri (screenplay), Juan José Campanella (screenplay), Eduardo Sacheri (novel)","Soledad Villamil, Ricardo Darín, Carla Quevedo, Pablo Rago","A retired legal counselor writes a novel hoping to find closure for one of his past unresolved homicide cases and for his unreciprocated love with his superior - both of which still haunt him decades later.","Spanish","Argentina, Spain","Won 1 Oscar. Another 52 wins & 42 nominations.","https://m.media-amazon.com/images/M/MV5BY2FhZGI5M2QtZWFiZS00NjkwLWE4NWQtMzg3ZDZjNjdkYTJiXkEyXkFqcGdeQXVyMTMxODk2OTU@._V1_SX300.jpg","Internet Movie Database",8.2,"80","8.2","182,140","tt1305806","movie","21 Sep 2010","$6,390,014","Sony Pictures Classics","N/A","True"
"143","Lock, Stock and Two Smoking Barrels","1998","R","28 Aug 1998","107 min","Comedy, Crime","Guy Ritchie","Guy Ritchie","Jason Flemyng, Dexter Fletcher, Nick Moran, Jason Statham","A botched card game in London triggers four friends, thugs, weed-growers, hard gangsters, loan sharks and debt collectors to collide with each other in a series of unexpected events, all for the sake of weed, cash and two antique shotguns.","English","UK","Nominated for 1 BAFTA Film Award. Another 13 wins & 7 nominations.","https://m.media-amazon.com/images/M/MV5BMTAyN2JmZmEtNjAyMy00NzYwLThmY2MtYWQ3OGNhNjExMmM4XkEyXkFqcGdeQXVyNDk3NzU2MTQ@._V1_SX300.jpg","Internet Movie Database",8.2,"66","8.2","514,783","tt0120735","movie","31 Aug 1999","N/A","Gramercy Pictures","N/A","True"
"144","Raging Bull","1980","R","19 Dec 1980","129 min","Biography, Drama, Sport","Martin Scorsese","Jake LaMotta (based on the book by), Joseph Carter (with), Peter Savage (with), Paul Schrader (screenplay), Mardik Martin (screenplay)","Robert De Niro, Cathy Moriarty, Joe Pesci, Frank Vincent","The life of boxer Jake LaMotta, whose violence and temper that led him to the top in the ring destroyed his life outside of it.","English","USA","Won 2 Oscars. Another 22 wins & 28 nominations.","https://m.media-amazon.com/images/M/MV5BYjRmODkzNDItMTNhNi00YjJlLTg0ZjAtODlhZTM0YzgzYThlXkEyXkFqcGdeQXVyNzQ1ODk3MTQ@._V1_SX300.jpg","Internet Movie Database",8.2,"89","8.2","305,874","tt0081398","movie","01 Aug 2000","N/A","United Artists","N/A","True"
"145","The Wolf of Wall Street","2013","R","25 Dec 2013","180 min","Biography, Crime, Drama","Martin Scorsese","Terence Winter (screenplay), Jordan Belfort (book)","Leonardo DiCaprio, Jonah Hill, Margot Robbie, Matthew McConaughey","Based on the true story of Jordan Belfort, from his rise to a wealthy stock-broker living the high life to his fall involving crime, corruption and the federal government.","English, French","USA","Nominated for 5 Oscars. Another 38 wins & 172 nominations.","https://m.media-amazon.com/images/M/MV5BMjIxMjgxNTk0MF5BMl5BanBnXkFtZTgwNjIyOTg2MDE@._V1_SX300.jpg","Internet Movie Database",8.2,"75","8.2","1,107,316","tt0993846","movie","25 Mar 2014","$91,330,760","Paramount Studios","N/A","True"
"146","Judgment at Nuremberg","1961","Not Rated","18 Dec 1961","179 min","Drama, War","Stanley Kramer","Abby Mann, Abby Mann (based on his original story by)","Spencer Tracy, Burt Lancaster, Richard Widmark, Marlene Dietrich","In 1948, an American court in occupied Germany tries four Nazis judged for war crimes.","English, German","USA","Won 2 Oscars. Another 14 wins & 25 nominations.","https://m.media-amazon.com/images/M/MV5BZDZjMTIwZTQtNTM3OS00OTUyLWI5MTMtOTNjYWVkNzhjMWIxXkEyXkFqcGdeQXVyNTc1NTQxODI@._V1_SX300.jpg","Internet Movie Database",8.2,"60","8.2","64,962","tt0055031","movie","07 Sep 2004","N/A","United Artists","N/A","True"
"147","The Treasure of the Sierra Madre","1948","Passed","24 Jan 1948","126 min","Adventure, Drama, Western","John Huston","John Huston (screenplay), B. Traven (based on the novel by)","Humphrey Bogart, Walter Huston, Tim Holt, Bruce Bennett","Two Americans searching for work in Mexico convince an old prospector to help them mine for gold in the Sierra Madre Mountains.","English, Spanish","USA, Mexico","Won 3 Oscars. Another 13 wins & 8 nominations.","https://m.media-amazon.com/images/M/MV5BOTJlZWMxYzEtMjlkMS00ODE0LThlM2ItMDI3NGQ2YjhmMzkxXkEyXkFqcGdeQXVyMDI2NDg0NQ@@._V1_SX300.jpg","Internet Movie Database",8.2,"98","8.2","108,160","tt0040897","movie","30 Sep 2003","N/A","WARNER BROTHERS PICTURES","N/A","True"
"148","There Will Be Blood","2007","R","25 Jan 2008","158 min","Drama","Paul Thomas Anderson","Paul Thomas Anderson (written for the screen by), Upton Sinclair (novel)","Daniel Day-Lewis, Martin Stringer, Matthew Braden Stringer, Jacob Stringer","A story of family, religion, hatred, oil and madness, focusing on a turn-of-the-century prospector in the early days of the business.","English, American Sign Language","USA","Won 2 Oscars. Another 110 wins & 136 nominations.","https://m.media-amazon.com/images/M/MV5BMjAxODQ4MDU5NV5BMl5BanBnXkFtZTcwMDU4MjU1MQ@@._V1_SX300.jpg","Internet Movie Database",8.2,"93","8.2","487,108","tt0469494","movie","08 Apr 2008","$40,133,435","Paramount Vantage","N/A","True"
"149","My Father and My Son","2005","N/A","18 Nov 2005","108 min","Drama, Family","Çagan Irmak","Çagan Irmak","Çetin Tekindor, Fikret Kuskan, Hümeyra, Ege Tanman","The family of a left-wing journalist is torn apart after a military coup in 1980's Turkey.","Turkish","Turkey","14 wins & 2 nominations.","https://m.media-amazon.com/images/M/MV5BNjAzMzEwYzctNjc1MC00Nzg5LWFmMGItMTgzYmMyNTY2OTQ4XkEyXkFqcGdeQXVyNjU0OTQ0OTY@._V1_SX300.jpg","Internet Movie Database",8.3,"N/A","8.3","72,860","tt0476735","movie","N/A","N/A","N/A","N/A","True"
"150","Three Billboards Outside Ebbing, Missouri","2017","R","01 Dec 2017","115 min","Comedy, Crime, Drama","Martin McDonagh","Martin McDonagh","Frances McDormand, Caleb Landry Jones, Kerry Condon, Sam Rockwell","A mother personally challenges the local authorities to solve her daughter's murder when they fail to catch the culprit.","English","UK, USA","Won 2 Oscars. Another 130 wins & 225 nominations.","https://m.media-amazon.com/images/M/MV5BMjI0ODcxNzM1N15BMl5BanBnXkFtZTgwMzIwMTEwNDI@._V1_SX300.jpg","Internet Movie Database",8.2,"88","8.2","394,263","tt5027774","movie","N/A","N/A","N/A","N/A","True"
"151","The Gold Rush","1925","Not Rated","13 Jul 1925","95 min","Adventure, Comedy, Drama, Family, Western","Charles Chaplin","Charles Chaplin","Charles Chaplin, Mack Swain, Tom Murray, Henry Bergman","A prospector goes to the Klondike in search of gold and finds it and more.","English","USA","Nominated for 2 Oscars. Another 3 wins & 1 nomination.","https://m.media-amazon.com/images/M/MV5BZjEyOTE4MzMtNmMzMy00Mzc3LWJlOTQtOGJiNDE0ZmJiOTU4L2ltYWdlXkEyXkFqcGdeQXVyNTAyODkwOQ@@._V1_SX300.jpg","Internet Movie Database",8.2,"N/A","8.2","93,913","tt0015864","movie","N/A","N/A","N/A","N/A","True"
"152","Chinatown","1974","R","20 Jun 1974","130 min","Drama, Mystery, Thriller","Roman Polanski","Robert Towne","Jack Nicholson, Faye Dunaway, John Huston, Perry Lopez","A private detective hired to expose an adulterer finds himself caught up in a web of deceit, corruption, and murder.","English, Cantonese, Spanish","USA","Won 1 Oscar. Another 20 wins & 24 nominations.","https://m.media-amazon.com/images/M/MV5BOGMwYmY5ZmEtMzY1Yi00OWJiLTk1Y2MtMzI2MjBhYmZkNTQ0XkEyXkFqcGdeQXVyNzkwMjQ5NzM@._V1_SX300.jpg","Internet Movie Database",8.2,"92","8.2","278,554","tt0071315","movie","23 Nov 1999","N/A","Paramount Pictures","N/A","True"
"153","Dial M for Murder","1954","PG","29 May 1954","105 min","Crime, Thriller","Alfred Hitchcock","Frederick Knott (screen play by), Frederick Knott","Ray Milland, Grace Kelly, Robert Cummings, John Williams","A tennis player frames his neglected wife for murder after she inadvertently foils his plan to have her murdered.","English","USA","Nominated for 1 BAFTA Film Award. Another 5 wins & 2 nominations.","https://m.media-amazon.com/images/M/MV5BOWIwODIxYWItZDI4MS00YzhhLWE3MmYtMzlhZDIwOTMzZmE5L2ltYWdlXkEyXkFqcGdeQXVyNjc1NTYyMjg@._V1_SX300.jpg","Internet Movie Database",8.2,"75","8.2","148,712","tt0046912","movie","07 Sep 2004","N/A","Warner Bros. Pictures","N/A","True"
"154","V for Vendetta","2005","R","17 Mar 2006","132 min","Action, Drama, Sci-Fi, Thriller","James McTeigue","Lilly Wachowski (screenplay), Lana Wachowski (screenplay), David Lloyd (graphic novel art)","Natalie Portman, Hugo Weaving, Stephen Rea, Stephen Fry","In a future British tyranny, a shadowy freedom fighter, known only by the alias of ""V"", plots to overthrow it with the help of a young woman.","English","USA, UK, Germany","7 wins & 27 nominations.","https://m.media-amazon.com/images/M/MV5BOTI5ODc3NzExNV5BMl5BanBnXkFtZTcwNzYxNzQzMw@@._V1_SX300.jpg","Internet Movie Database",8.2,"62","8.2","992,240","tt0434409","movie","01 Aug 2006","$70,500,000","Warner Bros. Pictures","N/A","True"
"155","The Seventh Seal","1957","Not Rated","13 Oct 1958","96 min","Drama, Fantasy","Ingmar Bergman","Ingmar Bergman (play), Ingmar Bergman (screenplay)","Gunnar Björnstrand, Bengt Ekerot, Nils Poppe, Max von Sydow","A man seeks answers about life, death, and the existence of God as he plays chess against the Grim Reaper during the Black Plague.","Swedish, Latin","Sweden","8 wins & 2 nominations.","https://m.media-amazon.com/images/M/MV5BM2I1ZWU4YjMtYzU0My00YmMzLWFmNTAtZDJhZGYwMmI3YWQ5XkEyXkFqcGdeQXVyNjU0OTQ0OTY@._V1_SX300.jpg","Internet Movie Database",8.2,"N/A","8.2","153,581","tt0050976","movie","17 Nov 2009","N/A","Janus Films","N/A","True"
"156","No Country for Old Men","2007","R","21 Nov 2007","122 min","Crime, Drama, Thriller","Ethan Coen, Joel Coen","Joel Coen (screenplay), Ethan Coen (screenplay), Cormac McCarthy (novel)","Tommy Lee Jones, Javier Bardem, Josh Brolin, Woody Harrelson","Violence and mayhem ensue after a hunter stumbles upon a drug deal gone wrong and more than two million dollars in cash near the Rio Grande.","English, Spanish","USA, Mexico","Won 4 Oscars. Another 159 wins & 138 nominations.","https://m.media-amazon.com/images/M/MV5BMjA5Njk3MjM4OV5BMl5BanBnXkFtZTcwMTc5MTE1MQ@@._V1_SX300.jpg","Internet Movie Database",8.1,"91","8.1","811,200","tt0477348","movie","07 Apr 2009","$74,223,625","Miramax Films","N/A","True"
"157","Inside Out","2015","PG","19 Jun 2015","95 min","Animation, Adventure, Comedy, Drama, Family, Fantasy","Pete Docter, Ronnie Del Carmen(co-director)","Pete Docter (original story by), Ronnie Del Carmen (original story by), Pete Docter (screenplay by), Meg LeFauve (screenplay by), Josh Cooley (screenplay by), Michael Arndt (additional story material by), Simon Rich (additional story material by), Bill Hader (additional dialogue by), Amy Poehler (additional dialogue by)","Amy Poehler, Phyllis Smith, Richard Kind, Bill Hader","After young Riley is uprooted from her Midwest life and moved to San Francisco, her emotions - Joy, Fear, Anger, Disgust and Sadness - conflict on how best to navigate a new city, house, and school.","English","USA","Won 1 Oscar. Another 97 wins & 114 nominations.","https://m.media-amazon.com/images/M/MV5BOTgxMDQwMDk0OF5BMl5BanBnXkFtZTgwNjU5OTg2NDE@._V1_SX300.jpg","Internet Movie Database",8.2,"94","8.2","577,209","tt2096673","movie","03 Nov 2015","$264,317,903","Disney/Pixar","N/A","True"
"158","Warrior","2011","PG-13","09 Sep 2011","140 min","Drama, Sport","Gavin O'Connor","Gavin O'Connor (screenplay), Anthony Tambakis (screenplay), Cliff Dorfman (screenplay), Gavin O'Connor (story), Cliff Dorfman (story)","Joel Edgerton, Tom Hardy, Nick Nolte, Jennifer Morrison","The youngest son of an alcoholic former boxer returns home, where he's trained by his father for competition in a mixed martial arts tournament - a path that puts the fighter on a collision course with his estranged, older brother.","English, Spanish","USA","Nominated for 1 Oscar. Another 5 wins & 21 nominations.","https://m.media-amazon.com/images/M/MV5BMTk4ODk5MTMyNV5BMl5BanBnXkFtZTcwMDMyNTg0Ng@@._V1_SX300.jpg","Internet Movie Database",8.2,"71","8.2","420,706","tt1291584","movie","20 Dec 2011","$13,600,000","Lionsgate","N/A","True"
"159","Shutter Island","2010","R","19 Feb 2010","138 min","Mystery, Thriller","Martin Scorsese","Laeta Kalogridis (screenplay), Dennis Lehane (novel)","Leonardo DiCaprio, Mark Ruffalo, Ben Kingsley, Max von Sydow","In 1954, a U.S. Marshal investigates the disappearance of a murderer who escaped from a hospital for the criminally insane.","English, German","USA","11 wins & 65 nominations.","https://m.media-amazon.com/images/M/MV5BYzhiNDkyNzktNTZmYS00ZTBkLTk2MDAtM2U0YjU1MzgxZjgzXkEyXkFqcGdeQXVyMTMxODk2OTU@._V1_SX300.jpg","Internet Movie Database",8.1,"63","8.1","1,071,216","tt1130884","movie","08 Jun 2010","$125,001,000","Paramount Studios","N/A","True"
"160","Trainspotting","1996","R","09 Aug 1996","93 min","Drama","Danny Boyle","Irvine Welsh (based on the novel by), John Hodge (screenplay)","Ewan McGregor, Ewen Bremner, Jonny Lee Miller, Kevin McKidd","Renton, deeply immersed in the Edinburgh drug scene, tries to clean up and get out, despite the allure of the drugs and influence of friends.","English","UK","Nominated for 1 Oscar. Another 23 wins & 33 nominations.","https://m.media-amazon.com/images/M/MV5BMzA5Zjc3ZTMtMmU5YS00YTMwLWI4MWUtYTU0YTVmNjVmODZhXkEyXkFqcGdeQXVyNjU0OTQ0OTY@._V1_SX300.jpg","Internet Movie Database",8.1,"83","8.1","614,293","tt0117951","movie","24 Mar 1998","N/A","Miramax Films","N/A","True"
"161","The Elephant Man","1980","PG","10 Oct 1980","124 min","Biography, Drama","David Lynch","Christopher De Vore (screenplay), Eric Bergren (screenplay), David Lynch (screenplay), Frederick Treves (book), Ashley Montagu (in part on the book ""The Elephant Man: A Study in Human Dignity"")","Anthony Hopkins, John Hurt, Anne Bancroft, John Gielgud","A Victorian surgeon rescues a heavily disfigured man who is mistreated while scraping a living as a side-show freak. Behind his monstrous façade, there is revealed a person of kindness, intelligence and sophistication.","English","USA, UK","Nominated for 8 Oscars. Another 10 wins & 13 nominations.","https://m.media-amazon.com/images/M/MV5BMDVjNjIwOGItNDE3Ny00OThjLWE0NzQtZTU3YjMzZTZjMzhkXkEyXkFqcGdeQXVyMTQxNzMzNDI@._V1_SX300.jpg","Internet Movie Database",8.1,"77","8.1","208,304","tt0080678","movie","11 Dec 2001","N/A","Paramount","N/A","True"
"162","The Sixth Sense","1999","PG-13","06 Aug 1999","107 min","Drama, Mystery, Thriller","M. Night Shyamalan","M. Night Shyamalan","Bruce Willis, Haley Joel Osment, Toni Collette, Olivia Williams","A boy who communicates with spirits seeks the help of a disheartened child psychologist.","English, Latin, Spanish","USA","Nominated for 6 Oscars. Another 36 wins & 49 nominations.","https://m.media-amazon.com/images/M/MV5BMWM4NTFhYjctNzUyNi00NGMwLTk3NTYtMDIyNTZmMzRlYmQyXkEyXkFqcGdeQXVyMTAwMzUyOTc@._V1_SX300.jpg","Internet Movie Database",8.1,"64","8.1","879,324","tt0167404","movie","28 Mar 2000","N/A","Hollywood/Buena Vista","N/A","True"
"163","The Thing","1982","R","25 Jun 1982","109 min","Horror, Mystery, Sci-Fi","John Carpenter","Bill Lancaster (screenplay), John W. Campbell Jr. (story)","Kurt Russell, Wilford Brimley, T.K. Carter, David Clennon","A research team in Antarctica is hunted by a shape-shifting alien that assumes the appearance of its victims.","English, Norwegian","USA","3 nominations.","https://m.media-amazon.com/images/M/MV5BNDcyZmFjY2YtN2I1OC00MzU3LWIzZGEtZDA5N2VlNDJjYWI3L2ltYWdlXkEyXkFqcGdeQXVyNTAyODkwOQ@@._V1_SX300.jpg","Internet Movie Database",8.1,"57","8.1","351,440","tt0084787","movie","28 Aug 2001","N/A","Universal Pictures","N/A","True"
"164","Gone with the Wind","1939","Passed","17 Jan 1940","238 min","Drama, History, Romance, War","Victor Fleming, George Cukor, Sam Wood","Margaret Mitchell (story of the old south ""Gone with the Wind""), Sidney Howard (screenplay)","Thomas Mitchell, Barbara O'Neil, Vivien Leigh, Evelyn Keyes","A manipulative woman and a roguish man conduct a turbulent romance during the American Civil War and Reconstruction periods.","English","USA","Won 8 Oscars. Another 12 wins & 12 nominations.","https://m.media-amazon.com/images/M/MV5BYjUyZWZkM2UtMzYxYy00ZmQ3LWFmZTQtOGE2YjBkNjA3YWZlXkEyXkFqcGdeQXVyNzkwMjQ5NzM@._V1_SX300.jpg","Internet Movie Database",8.1,"97","8.1","276,652","tt0031381","movie","07 Mar 2000","N/A","Loew&#39;s Inc.","N/A","True"
"165","Room","2015","R","22 Jan 2016","118 min","Drama, Thriller","Lenny Abrahamson","Emma Donoghue (screenplay by), Emma Donoghue (based on the novel by)","Brie Larson, Jacob Tremblay, Sean Bridgers, Wendy Crewson","Held captive for 7 years in an enclosed space, a woman and her young son finally gain their freedom, allowing the boy to experience the outside world for the first time.","English","Ireland, Canada, UK, USA","Won 1 Oscar. Another 104 wins & 140 nominations.","https://m.media-amazon.com/images/M/MV5BMjE4NzgzNzEwMl5BMl5BanBnXkFtZTgwMTMzMDE0NjE@._V1_SX300.jpg","Internet Movie Database",8.1,"86","8.1","345,782","tt3170832","movie","01 Mar 2016","$14,677,654","Element Pictures","N/A","True"
"166","Jurassic Park","1993","PG-13","11 Jun 1993","127 min","Action, Adventure, Sci-Fi, Thriller","Steven Spielberg","Michael Crichton (novel), Michael Crichton (screenplay), David Koepp (screenplay)","Sam Neill, Laura Dern, Jeff Goldblum, Richard Attenborough","A pragmatic paleontologist visiting an almost complete theme park is tasked with protecting a couple of kids after a power failure causes the park's cloned dinosaurs to run loose.","English, Spanish","USA","Won 3 Oscars. Another 39 wins & 27 nominations.","https://m.media-amazon.com/images/M/MV5BMjM2MDgxMDg0Nl5BMl5BanBnXkFtZTgwNTM2OTM5NDE@._V1_SX300.jpg","Internet Movie Database",8.1,"68","8.1","819,174","tt0107290","movie","10 Oct 2000","$45,299,680","Universal Pictures","N/A","True"
"167","Wild Strawberries","1957","Not Rated","22 Jun 1959","91 min","Drama, Romance","Ingmar Bergman","Ingmar Bergman","Victor Sjöström, Bibi Andersson, Ingrid Thulin, Gunnar Björnstrand","After living a life marked by coldness, an aging professor is forced to confront the emptiness of his existence.","Swedish, Latin","Sweden","Nominated for 1 Oscar. Another 16 wins & 3 nominations.","https://m.media-amazon.com/images/M/MV5BYzdkODZlOGItY2RjZC00Mzc5LWI5NzMtZDUyMmNhNjljOWE2XkEyXkFqcGdeQXVyOTk4MjA5NjQ@._V1_SX300.jpg","Internet Movie Database",8.2,"N/A","8.2","89,638","tt0050986","movie","12 Feb 2002","N/A","Janus Films","N/A","True"
"168","Blade Runner","1982","R","25 Jun 1982","117 min","Action, Sci-Fi, Thriller","Ridley Scott","Hampton Fancher (screenplay), David Webb Peoples (screenplay), Philip K. Dick (novel)","Harrison Ford, Rutger Hauer, Sean Young, Edward James Olmos","A blade runner must pursue and terminate four replicants who stole a ship in space, and have returned to Earth to find their creator.","English, German, Cantonese, Japanese, Hungarian, Arabic","USA","Nominated for 2 Oscars. Another 12 wins & 16 nominations.","https://m.media-amazon.com/images/M/MV5BNzQzMzJhZTEtOWM4NS00MTdhLTg0YjgtMjM4MDRkZjUwZDBlXkEyXkFqcGdeQXVyNjU0OTQ0OTY@._V1_SX300.jpg","Internet Movie Database",8.1,"84","8.1","663,604","tt0083658","movie","27 Aug 1997","N/A","Warner Bros. Pictures","N/A","True"
"169","The Bridge on the River Kwai","1957","PG","14 Dec 1957","161 min","Adventure, Drama, War","David Lean","Pierre Boulle (novel), Carl Foreman (screenplay), Michael Wilson (screenplay)","William Holden, Alec Guinness, Jack Hawkins, Sessue Hayakawa","British POWs build a railway bridge across the river Kwai for their Japanese captors, oblivious of the Allies' plans to destroy it.","English, Japanese, Thai","UK, USA","Won 7 Oscars. Another 23 wins & 7 nominations.","https://m.media-amazon.com/images/M/MV5BMGVhNjhjODktODgxYS00MDdhLTlkZjktYTkyNzQxMTU0ZDYxXkEyXkFqcGdeQXVyNzkwMjQ5NzM@._V1_SX300.jpg","Internet Movie Database",8.1,"87","8.1","194,188","tt0050212","movie","21 Nov 2000","N/A","Columbia Pictures","N/A","True"
"170","Finding Nemo","2003","G","30 May 2003","100 min","Animation, Adventure, Comedy, Family","Andrew Stanton, Lee Unkrich(co-director)","Andrew Stanton (original story by), Andrew Stanton (screenplay by), Bob Peterson (screenplay by), David Reynolds (screenplay by)","Albert Brooks, Ellen DeGeneres, Alexander Gould, Willem Dafoe","After his son is captured in the Great Barrier Reef and taken to Sydney, a timid clownfish sets out on a journey to bring him home.","English","USA, Australia","Won 1 Oscar. Another 49 wins & 62 nominations.","https://m.media-amazon.com/images/M/MV5BZTAzNWZlNmUtZDEzYi00ZjA5LWIwYjEtZGM1NWE1MjE4YWRhXkEyXkFqcGdeQXVyNjU0OTQ0OTY@._V1_SX300.jpg","Internet Movie Database",8.1,"90","8.1","911,647","tt0266543","movie","07 May 2013","$380,529,370","Walt Disney Pictures","N/A","True"
